{
  "stac_version": "1.0.0",
  "stac_extensions": [
    "https://stac-extensions.github.io/3d-city-models/v0.1.0/schema.json",
    "https://stac-extensions.github.io/projection/v2.0.0/schema.json",
    "https://stac-extensions.github.io/file/v2.1.0/schema.json"
  ],
  "type": "Feature",
  "id": "delft.city",
  "bbox": [
    74782.684,
    419982.871,
    -14.93,
    100067.947,
    450171.531,
    207.042
  ],
  "geometry": {
    "type": "Polygon",
    "coordinates": [
      [
        [
          74782.684,
          419982.871
        ],
        [
          100067.947,
          419982.871
        ],
        [
          100067.947,
          450171.531
        ],
        [
          74782.684,
          450171.531
        ],
        [
          74782.684,
          419982.871
        ]
      ]
    ]
  },
  "properties": {
    "city3d:encoding": "CityJSON",
    "proj:epsg": 7415,
    "city3d:version": "2.0",
    "datetime": "2026-02-11T20:09:31.928903197+00:00",
    "city3d:city_objects": 0,
    "file:size": 671
  },
  "assets": {
    "data": {
      "href": "delft.city.json",
      "type": "application/json",
      "title": "CityJSON data file",
      "roles": [
        "data"
      ]
    }
  },
  "links": []
}