{
  "stac_version": "1.0.0",
  "stac_extensions": [
    "https://raw.githubusercontent.com/cityjson/cityjson-stac/main/stac-extension/schema.json",
    "https://stac-extensions.github.io/projection/v1.1.0/schema.json"
  ],
  "type": "Feature",
  "id": "delft.city",
  "bbox": [
    74782.684,
    419982.871,
    -14.93,
    100067.947,
    450171.531,
    207.042
  ],
  "geometry": {
    "coordinates": [
      [
        [
          74782.684,
          419982.871
        ],
        [
          100067.947,
          419982.871
        ],
        [
          100067.947,
          450171.531
        ],
        [
          74782.684,
          450171.531
        ],
        [
          74782.684,
          419982.871
        ]
      ]
    ],
    "type": "Polygon"
  },
  "properties": {
    "datetime": "2026-02-03T14:22:44.108874+00:00",
    "cj:city_objects": 0,
    "cj:transform": {
      "scale": [
        0.001,
        0.001,
        0.001
      ],
      "translate": [
        9223372037026576.0,
        9223372037327476.0,
        9223372036854776.0
      ]
    },
    "cj:metadata": {
      "geographicalExtent": [
        74782.684,
        419982.871,
        -14.93,
        100067.947,
        450171.531,
        207.042
      ],
      "pointOfContact": {
        "contactName": "3DBAG Team",
        "emailAddress": "info@3dbag.nl",
        "role": "owner",
        "website": "https://3dbag.nl"
      },
      "referenceSystem": "https://www.opengis.net/def/crs/EPSG/0/7415",
      "title": "3DBAG"
    },
    "proj:epsg": 7415,
    "cj:encoding": "CityJSON",
    "cj:version": "2.0"
  },
  "assets": {
    "data": {
      "href": "/Users/hbbaba/tudelft/cityjson/cityjson-stac/tests/data/delft.city.json",
      "type": "application/json",
      "title": "CityJSON data file",
      "roles": [
        "data"
      ]
    }
  },
  "links": []
}